{"$schema":"https://json-schema.org/draft/2020-12/schema","$id":"UiVisualEvidenceV1","type":"object","additionalProperties":false,"required":["status","pins","conceptImagesAreGolden","baselineAutoUpdate","candidateThresholds","masks","requiredViewports"],"properties":{"status":{"const":"BLOCKED_MANUAL_DEVICE_EVIDENCE"},"pins":{"type":"object","additionalProperties":false,"required":["node","pnpm","runner","ios","android","emulator","font","fontScale","locale","gpu","seed","time"],"properties":{"node":{"type":"string","pattern":"^[0-9]+\\.[0-9]+\\.[0-9]+$"},"pnpm":{"type":"string","pattern":"^[0-9]+\\.[0-9]+\\.[0-9]+$"},"runner":{"type":"string","minLength":1},"ios":{"type":"string","minLength":1},"android":{"type":"string","minLength":1},"emulator":{"type":"string","minLength":1},"font":{"type":"string","minLength":1},"fontScale":{"type":"number","minimum":1,"maximum":2},"locale":{"type":"string","pattern":"^[a-z]{2}-[A-Z]{2}$"},"gpu":{"type":"string","minLength":1},"seed":{"type":"integer","minimum":0},"time":{"type":"string","format":"date-time"}}},"conceptImagesAreGolden":{"const":false},"baselineAutoUpdate":{"const":false},"candidateThresholds":{"type":"object","additionalProperties":false,"required":["ssim","rgbAbsoluteDifference","maxDifferentPixelRatio","calibrated"],"properties":{"ssim":{"type":"number","minimum":0,"maximum":1},"rgbAbsoluteDifference":{"type":"number","minimum":0,"maximum":1},"maxDifferentPixelRatio":{"type":"number","minimum":0,"maximum":1},"calibrated":{"type":"boolean"}}},"masks":{"type":"array","uniqueItems":true,"items":{"enum":["LIVE_TIMER","NETWORK_STATUS","USER_DATA","ANIMATION_FRAME"]}},"requiredViewports":{"type":"array","minItems":1,"uniqueItems":true,"items":{"type":"array","prefixItems":[{"type":"integer","minimum":1,"maximum":4096},{"type":"integer","minimum":1,"maximum":4096}],"items":false,"minItems":2,"maxItems":2}}}}
